{
    "$schema":  "../../schema/validations.schema.json",
    "schema_version":  "1.0.0",
    "form_id":  "1800-v2018",
    "revision":  "2018-01-01",
    "first_error_behavior":  "Validate checks treaty description, donor TIN, RDO, then date; it returns on the first failure. Save calls checkDate1 before its narrower initialValidateBeforeSave checks.",
    "rules":  [
                  {
                      "rule_id":  "1800-save-001-future-date",
                      "form_id":  "1800-v2018",
                      "revision":  "2018-01-01",
                      "phase":  "save",
                      "order":  1,
                      "condition":  "Donation date compares later than the current date.",
                      "fields":  [
                                     "frm1800v2018:txtMonth",
                                     "frm1800v2018:txtDate",
                                     "frm1800v2018:txtYear"
                                 ],
                      "accepted_behavior":  "Condition is false; processing continues.",
                      "rejected_behavior":  "The active operation stops unless official_behavior states otherwise.",
                      "exact_message":  "Date of donation should not be later than the current date.",
                      "source_refs":  [
                                          "official-hta-runtime#saveXML:L3118",
                                          "official-hta-runtime#checkDate1:L4620-L4648"
                                      ],
                      "evidence_type":  [
                                            "source"
                                        ],
                      "assessment":  "verified-correct",
                      "official_behavior":  "The branch alerts and stops the active operation.",
                      "recommended_app_behavior":  "Retain as a structured revision-aware error.",
                      "confidence":  "high",
                      "unresolved_questions":  [

                                               ]
                  },
                  {
                      "rule_id":  "1800-save-002-date-required",
                      "form_id":  "1800-v2018",
                      "revision":  "2018-01-01",
                      "phase":  "save",
                      "order":  2,
                      "condition":  "Month or day is 00, or year is blank.",
                      "fields":  [
                                     "frm1800v2018:txtMonth",
                                     "frm1800v2018:txtDate",
                                     "frm1800v2018:txtYear"
                                 ],
                      "accepted_behavior":  "Condition is false; processing continues.",
                      "rejected_behavior":  "The active operation stops unless official_behavior states otherwise.",
                      "exact_message":  "Please enter a valid date on Item 1.",
                      "source_refs":  [
                                          "official-hta-runtime#checkDate1:L4636-L4640"
                                      ],
                      "evidence_type":  [
                                            "source"
                                        ],
                      "assessment":  "verified-correct",
                      "official_behavior":  "The branch alerts and stops the active operation.",
                      "recommended_app_behavior":  "Retain as a structured revision-aware error.",
                      "confidence":  "high",
                      "unresolved_questions":  [

                                               ]
                  },
                  {
                      "rule_id":  "1800-save-003-year-width",
                      "form_id":  "1800-v2018",
                      "revision":  "2018-01-01",
                      "phase":  "save",
                      "order":  3,
                      "condition":  "Year value has fewer than four characters.",
                      "fields":  [
                                     "frm1800v2018:txtYear"
                                 ],
                      "accepted_behavior":  "Condition is false; processing continues.",
                      "rejected_behavior":  "The active operation stops unless official_behavior states otherwise.",
                      "exact_message":  "Please enter a valid Year(YYYY)",
                      "source_refs":  [
                                          "official-hta-runtime#checkDate1:L4641-L4644"
                                      ],
                      "evidence_type":  [
                                            "source"
                                        ],
                      "assessment":  "verified-correct",
                      "official_behavior":  "The branch alerts and stops the active operation.",
                      "recommended_app_behavior":  "Retain as a structured revision-aware error.",
                      "confidence":  "high",
                      "unresolved_questions":  [

                                               ]
                  },
                  {
                      "rule_id":  "1800-save-004-redundant-return-date",
                      "form_id":  "1800-v2018",
                      "revision":  "2018-01-01",
                      "phase":  "save",
                      "order":  4,
                      "condition":  "All three date values equal the empty string.",
                      "fields":  [
                                     "frm1800v2018:txtMonth",
                                     "frm1800v2018:txtDate",
                                     "frm1800v2018:txtYear"
                                 ],
                      "accepted_behavior":  "Condition is false; processing continues.",
                      "rejected_behavior":  "The active operation stops unless official_behavior states otherwise.",
                      "exact_message":  "Please enter a valid Return Date",
                      "source_refs":  [
                                          "official-hta-runtime#initialValidateBeforeSave:L5072-L5076"
                                      ],
                      "evidence_type":  [
                                            "source"
                                        ],
                      "assessment":  "obsolete",
                      "official_behavior":  "checkDate1 runs first and the select defaults are 00, so this branch is not the operative missing-date check.",
                      "recommended_app_behavior":  "Use one typed date validator.",
                      "confidence":  "high",
                      "unresolved_questions":  [

                                               ]
                  },
                  {
                      "rule_id":  "1800-save-005-broken-year-property",
                      "form_id":  "1800-v2018",
                      "revision":  "2018-01-01",
                      "phase":  "save",
                      "order":  5,
                      "condition":  "The code compares the DOM element length property, not txtYear.value.length, with 4.",
                      "fields":  [
                                     "frm1800v2018:txtYear"
                                 ],
                      "accepted_behavior":  "Condition is false; processing continues.",
                      "rejected_behavior":  "The active operation stops unless official_behavior states otherwise.",
                      "exact_message":  "Please enter a valid Year(YYYY)",
                      "source_refs":  [
                                          "official-hta-runtime#initialValidateBeforeSave:L5077-L5080"
                                      ],
                      "evidence_type":  [
                                            "source"
                                        ],
                      "assessment":  "incorrect-official-behavior",
                      "official_behavior":  "The element length is undefined, making this duplicate branch ineffective.",
                      "recommended_app_behavior":  "Validate the value once.",
                      "confidence":  "high",
                      "unresolved_questions":  [

                                               ]
                  },
                  {
                      "rule_id":  "1800-save-006-tin",
                      "form_id":  "1800-v2018",
                      "revision":  "2018-01-01",
                      "phase":  "save",
                      "order":  6,
                      "condition":  "Any donor TIN segment or branch code is blank.",
                      "fields":  [
                                     "frm1800v2018:txtTIN1",
                                     "frm1800v2018:txtTIN2",
                                     "frm1800v2018:txtTIN3",
                                     "frm1800v2018:txtBranchCode"
                                 ],
                      "accepted_behavior":  "Condition is false; processing continues.",
                      "rejected_behavior":  "The active operation stops unless official_behavior states otherwise.",
                      "exact_message":  "Please enter a valid TIN number on Item 5.",
                      "source_refs":  [
                                          "official-hta-runtime#initialValidateBeforeSave:L5081-L5085"
                                      ],
                      "evidence_type":  [
                                            "source"
                                        ],
                      "assessment":  "incorrect-official-behavior",
                      "official_behavior":  "Only blankness is checked.",
                      "recommended_app_behavior":  "Validate exact segment lengths, characters, and checksum before finalization.",
                      "confidence":  "high",